{
  "periodKey": "20A2",
  "vatDueSales": 105.50,
  "vatDueAcquisitions": -100.45,
  "totalVatDue": 5.05,
  "vatReclaimedCurrPeriod": 105.15,
  "netVatDue": 100.10,
  "totalValueSalesExVAT": 300,
  "totalValuePurchasesExVAT": 300,
  "totalValueGoodsSuppliedExVAT": 3000,
  "totalAcquisitionsExVAT": 3000,
  "receivedAt": "2017-01-01T00:01:00Z",
  "uniqueId": "a2-b3.cd5e"
}